{
  "$schema": "https://json-schema.org/draft/2020-12/schema",
  "$id": "https://github.com/jagmarques/asqav-registry/blob/main/registry/type-namespaces.schema.json",
  "title": "Compliance Receipt Type Namespaces Registry",
  "type": "object",
  "required": ["version", "updated", "registry", "entries"],
  "additionalProperties": true,
  "properties": {
    "version": {"type": "string", "pattern": "^[0-9]+\\.[0-9]+\\.[0-9]+$"},
    "updated": {"type": "string", "format": "date"},
    "registry": {"const": "Compliance Receipt Type Namespaces"},
    "registration_process": {"type": "string", "format": "uri"},
    "note": {"type": "string"},
    "entries": {
      "type": "array",
      "items": {"$ref": "#/$defs/entry"}
    }
  },
  "$defs": {
    "entry": {
      "type": "object",
      "required": ["namespace", "description", "reference", "change_controller"],
      "additionalProperties": false,
      "properties": {
        "namespace": {
          "type": "string",
          "pattern": "^[a-z0-9_-]+(:[a-z0-9_-]+)*$",
          "description": "A colon-separated identifier prefix used as a value of the type field. A namespace of the form parent:suffix is a sub-namespace and inherits its parent's change controller."
        },
        "description": {"type": "string", "minLength": 1},
        "reference": {"type": "string", "minLength": 1},
        "change_controller": {"type": "string", "minLength": 1}
      }
    }
  }
}
